{
  "$schema": "./mini-app-schema.json",
  "meta": {
    "title": "TechStore",
    "logo": "/logo.png",
    "locale": "en",
    "currency": "USD",
    "theme": {
      "primaryColor": "#007AFF",
      "secondaryColor": "#5856D6"
    }
  },
  "dataModel": {
    "Product": {
      "name": "Product",
      "fields": {
        "id": { "type": "string", "required": true },
        "name": { "type": "string", "required": true },
        "price": { "type": "number", "required": true },
        "image": { "type": "string", "required": false },
        "description": { "type": "string", "required": false },
        "category": { "type": "string", "required": false }
      }
    },
    "Promo": {
      "name": "Promo",
      "fields": {
        "id": { "type": "string", "required": true },
        "title": { "type": "string", "required": true },
        "description": { "type": "string", "required": false },
        "image": { "type": "string", "required": false },
        "backgroundColor": { "type": "string", "required": false }
      }
    },
    "Cart": {
      "name": "Cart",
      "fields": {
        "items": { "type": "array", "required": true },
        "total": { "type": "number", "required": true }
      }
    },
    "Order": {
      "name": "Order",
      "fields": {
        "id": { "type": "string", "required": true },
        "items": { "type": "array", "required": true },
        "total": { "type": "number", "required": true },
        "status": { "type": "string", "required": true },
        "createdAt": { "type": "string", "required": true }
      }
    }
  },
  "pages": [
    {
      "id": "home",
      "title": "TechStore",
      "route": "/",
      "components": [
        {
          "id": "promo-slider-1",
          "type": "PromoSlider",
          "props": {
            "autoPlay": true,
            "autoPlayInterval": 5000,
            "height": "md",
            "slides": [
              {
                "id": "promo-1",
                "title": "Summer Sale",
                "description": "Up to 50% off on selected items",
                "image": "https://images.unsplash.com/photo-1607082348824-0a96f2a4b9da?w=800",
                "ctaText": "Shop Now"
              },
              {
                "id": "promo-2",
                "title": "New Arrivals",
                "description": "Check out the latest tech gadgets",
                "image": "https://images.unsplash.com/photo-1519389950473-47ba0277781c?w=800",
                "backgroundColor": "#4ECDC4",
                "ctaText": "Explore"
              },
              {
                "id": "promo-3",
                "title": "Free Shipping",
                "description": "On orders over $100",
                "backgroundColor": "#45B7D1"
              }
            ]
          }
        },
        {
          "id": "search-bar-1",
          "type": "SearchBar",
          "props": {
            "placeholder": "Search products..."
          }
        },
        {
          "id": "product-list-featured",
          "type": "ProductList",
          "props": {
            "title": "Featured Products",
            "description": "Our best sellers",
            "columns": 2,
            "limit": 6,
            "data": [
              {
                "id": "1",
                "name": "Wireless Earbuds Pro",
                "price": 149.99,
                "image": "https://images.unsplash.com/photo-1590658268037-6bf12165a8df?w=400",
                "description": "Premium wireless earbuds with active noise cancellation",
                "category": "Audio",
                "badge": "Best Seller"
              },
              {
                "id": "2",
                "name": "Smart Watch Series 5",
                "price": 399.99,
                "image": "https://images.unsplash.com/photo-1579586337278-3befd40fd17a?w=400",
                "description": "Advanced smartwatch with health monitoring",
                "category": "Wearables",
                "badge": "New"
              },
              {
                "id": "3",
                "name": "Portable Power Bank",
                "price": 49.99,
                "image": "https://images.unsplash.com/photo-1609091839311-d5365f9ff1c5?w=400",
                "description": "20000mAh fast charging power bank",
                "category": "Accessories"
              },
              {
                "id": "4",
                "name": "Bluetooth Speaker",
                "price": 79.99,
                "image": "https://images.unsplash.com/photo-1608043152269-423dbba4e7e1?w=400",
                "description": "Waterproof portable speaker with 360° sound",
                "category": "Audio"
              },
              {
                "id": "5",
                "name": "USB-C Hub Multiport",
                "price": 59.99,
                "image": "https://images.unsplash.com/photo-1625841442290-98c949728613?w=400",
                "description": "7-in-1 USB-C hub with HDMI and SD card reader",
                "category": "Accessories"
              },
              {
                "id": "6",
                "name": "Mechanical Keyboard",
                "price": 129.99,
                "image": "https://images.unsplash.com/photo-1595225476474-87563907a212?w=400",
                "description": "RGB mechanical keyboard with Cherry MX switches",
                "category": "Peripherals",
                "badge": "Sale"
              }
            ]
          }
        },
        {
          "id": "product-list-new",
          "type": "ProductList",
          "props": {
            "title": "New Arrivals",
            "description": "Check out the latest tech",
            "columns": 2,
            "limit": 4,
            "data": [
              {
                "id": "7",
                "name": "Wireless Mouse",
                "price": 69.99,
                "image": "https://images.unsplash.com/photo-1527864550417-7fd91fc51a46?w=400",
                "description": "Ergonomic wireless mouse with precision tracking",
                "category": "Peripherals",
                "badge": "New"
              },
              {
                "id": "8",
                "name": "Laptop Stand",
                "price": 39.99,
                "image": "https://images.unsplash.com/photo-1611186871348-b1ce696e52c9?w=400",
                "description": "Adjustable aluminum laptop stand",
                "category": "Accessories"
              },
              {
                "id": "9",
                "name": "Webcam 4K Pro",
                "price": 199.99,
                "image": "https://images.unsplash.com/photo-1587825140708-dfaf72ae4b04?w=400",
                "description": "4K webcam with auto-focus and noise cancellation",
                "category": "Peripherals",
                "badge": "Hot"
              },
              {
                "id": "10",
                "name": "Phone Stand",
                "price": 19.99,
                "image": "https://images.unsplash.com/photo-1586953229609-7e0c50d40074?w=400",
                "description": "Adjustable phone stand for desk",
                "category": "Accessories"
              }
            ]
          }
        }
      ]
    },
    {
      "id": "catalog",
      "title": "Catalog",
      "route": "/catalog",
      "components": [
        {
          "id": "search-bar-catalog",
          "type": "SearchBar",
          "props": {
            "placeholder": "Search catalog..."
          }
        },
        {
          "id": "filter-panel-1",
          "type": "FilterPanel",
          "props": {
            "categories": [
              { "id": "audio", "label": "Audio", "count": 2 },
              { "id": "wearables", "label": "Wearables", "count": 1 },
              { "id": "accessories", "label": "Accessories", "count": 4 },
              { "id": "peripherals", "label": "Peripherals", "count": 3 }
            ],
            "priceRange": { "min": 0, "max": 500 }
          }
        },
        {
          "id": "product-list-catalog",
          "type": "ProductList",
          "props": {
            "title": "All Products",
            "columns": 2,
            "enableFiltering": true,
            "data": [
              {
                "id": "1",
                "name": "Wireless Earbuds Pro",
                "price": 149.99,
                "image": "https://images.unsplash.com/photo-1590658268037-6bf12165a8df?w=400",
                "description": "Premium wireless earbuds with active noise cancellation",
                "category": "Audio"
              },
              {
                "id": "2",
                "name": "Smart Watch Series 5",
                "price": 399.99,
                "image": "https://images.unsplash.com/photo-1579586337278-3befd40fd17a?w=400",
                "description": "Advanced smartwatch with health monitoring",
                "category": "Wearables"
              },
              {
                "id": "3",
                "name": "Portable Power Bank",
                "price": 49.99,
                "image": "https://images.unsplash.com/photo-1609091839311-d5365f9ff1c5?w=400",
                "description": "20000mAh fast charging power bank",
                "category": "Accessories"
              },
              {
                "id": "4",
                "name": "Bluetooth Speaker",
                "price": 79.99,
                "image": "https://images.unsplash.com/photo-1608043152269-423dbba4e7e1?w=400",
                "description": "Waterproof portable speaker with 360° sound",
                "category": "Audio"
              },
              {
                "id": "5",
                "name": "USB-C Hub Multiport",
                "price": 59.99,
                "image": "https://images.unsplash.com/photo-1625841442290-98c949728613?w=400",
                "description": "7-in-1 USB-C hub with HDMI and SD card reader",